{"authorizations":{"a0_development_fit_authorized":false,"a1_development_fit_authorized":false,"batch_slot_execution_authorized":false,"calibration_authorized":false,"calibration_target_access_authorized":false,"dvc_commands_authorized":false,"e0_m_authorized":false,"e0_u_authorized":false,"effective_in_payload":false,"evaluation_authorized":false,"final_e7_metrics_authorized":false,"future_outcomes_accessed":false,"outcome_access_authorized":false,"publication_required":true,"rollout_authorized":false,"scientific_network_authorized":false,"selection_diagnostics_authorized":false,"target_access_through_2020_authorized":false},"companion_contract":{"historical_input_count":4,"historical_inputs_sha256":"8d514e4152ed6533a0235149ae414793879f18d38307234443aff40fa5712857","manifest_written_last":true,"output_count":1,"physical_input_count":64,"physical_inputs_sha256":"59c87c8c648f0642c75276e01863bf56817727c83eefb25535549bebf975a957","script_path":"src/experiments/lock_closure_anfis_ablation_training_cohort_patch.py"},"correction_evidence":{"calibration_2021_targets_read":false,"check_only_preflight_started":true,"deprecated_operation":"set_index_verify_integrity","development_targets_through_2020_read":true,"dvc_commands_run":false,"evidence_source":"derived_from_published_inputs_and_failed_check_only_facts","execute_one_shot_invoked":false,"fit_started":false,"future_outcomes_accessed":false,"guard_created":false,"holdout_or_post_2021_targets_read":false,"input_only_scaler_origin_count":8352,"invocation_mode":"--check-only","observed_tp_value_count":163839,"p_mt_gate_status":"effective_preflight_passed","pandas4warning_count":2,"pseudo_selection_rows":1974,"pseudo_training_rows":17796,"sealed_tp_value_count":80271,"stdout_persisted":false,"supervised_selection_origin_count":658,"supervised_training_origin_count":5932,"terminal_error":"Raw observed count drifted for x_mean_TP_ugL","trainer_cli_started":true,"writes_created":false},"created_at_utc":"2026-08-08T17:31:16.023437+00:00","gate":"E0-MU","h_patch":{"base_commit":"1b68c24da4efe8fcf5eeb4b90ad0a99e95c96d93","component_count":9,"components":[{"bytes":18464,"path":"configs/closure_v1/anfis_ablation_training_cohort_patch_lock.schema.json","role":"anfis_ablation_training_cohort_patch_lock_schema","sha256":"cdfc474149134a29c177b924baa95f7f2410a84ea24db7c0551151026ca4ad21"},{"bytes":8898,"path":"docs/closure_v1/E0_M_ANFIS_ABLATION_TRAINING_COHORT_PATCH_1.md","role":"anfis_ablation_training_cohort_patch_protocol","sha256":"7914f4f7589b03c75f1f4418ff7f2610431b0d6fca22b449e33d52017106b788"},{"bytes":80789,"path":"src/experiments/audit_closure_anfis_ablation_model_bundle.py","role":"corrected_anfis_ablation_model_bundle_auditor","sha256":"62d06863df88c8ab1f56f674e0238e942cebc7b8a1277893e690d715a90e9364"},{"bytes":66138,"path":"src/experiments/closure_anfis_ablation_training_cohort_patch.py","role":"anfis_ablation_training_cohort_patch_validator","sha256":"fc7c22ced91cfb3a431e3feec892f0e9580cfce05636a5749eea81fa5afb2e9f"},{"bytes":4544,"path":"src/experiments/lock_closure_anfis_ablation_training_cohort_patch.py","role":"anfis_ablation_training_cohort_patch_locker","sha256":"b89f9ed3f19671e38507ff5d0c73fbdce3592a2a459b11fe73cc04c7cd84cb2c"},{"bytes":107577,"path":"src/experiments/train_closure_anfis_ablation.py","role":"corrected_anfis_ablation_trainer","sha256":"608786d9da2c263cbae5010dd19d6a6acc61df25d4c370c1e1312526693eca7e"},{"bytes":41095,"path":"tests/test_audit_closure_anfis_ablation_model_bundle.py","role":"corrected_anfis_ablation_model_bundle_auditor_tests","sha256":"5985208e1b418032567ef9aa50e60353475955a3216771ad343b168f87c8e1b8"},{"bytes":42269,"path":"tests/test_closure_anfis_ablation_training_cohort_patch.py","role":"anfis_ablation_training_cohort_patch_tests","sha256":"da280ba6dbbae2e0ed2918a315e25decf54f3313fe8e83ff1f9d2994d08f3a0e"},{"bytes":20657,"path":"tests/test_train_closure_anfis_ablation.py","role":"corrected_anfis_ablation_trainer_tests","sha256":"e4b9ce947df6bd66ff09dcc22feab20c9c5c28dbe776e90496fb9403c845735c"}],"components_git_mode":"100644","components_sha256":"6b4654ae79282bddd73e2e81f5f7d4686329130b4b2aeff27e128edc71bb0205","head":"3fff3f272eb6f6ba8e644dd49436bc39ecbed1f8","parent":"1b68c24da4efe8fcf5eeb4b90ad0a99e95c96d93","scope":{"added":5,"deleted":0,"modified":4}},"mt_authority":{"h_components_git_mode":"100644","h_head":"f371786bc1e8d6c22b4d911145a57c623303b296","h_parent":"e22fd44d8a1e13c5587237d9f7a38856ae262864","h_scope":{"added":10,"deleted":0,"modified":0},"historical_component_count":4,"historical_components":[{"bytes":80791,"commit":"f371786bc1e8d6c22b4d911145a57c623303b296","current_bytes_required_to_match_historical":false,"hash_source":"git_blob_at_commit","path":"src/experiments/audit_closure_anfis_ablation_model_bundle.py","role":"superseded_mt_anfis_ablation_model_bundle_auditor","sha256":"2528a0a0fb791b0e87a39262b7a1f44c6500252dacce51857d5eb069dd522558"},{"bytes":103721,"commit":"f371786bc1e8d6c22b4d911145a57c623303b296","current_bytes_required_to_match_historical":false,"hash_source":"git_blob_at_commit","path":"src/experiments/train_closure_anfis_ablation.py","role":"superseded_mt_anfis_ablation_trainer","sha256":"d46967928314cf7a46b2b7dc4249410632f42dbaa6788f4b89f552226aa17dfe"},{"bytes":40651,"commit":"f371786bc1e8d6c22b4d911145a57c623303b296","current_bytes_required_to_match_historical":false,"hash_source":"git_blob_at_commit","path":"tests/test_audit_closure_anfis_ablation_model_bundle.py","role":"superseded_mt_anfis_ablation_model_bundle_auditor_tests","sha256":"318415f6c9662d75564ec74a9c4819ab20cbe5e51b78594b79ed7009dd9eb5e2"},{"bytes":15254,"commit":"f371786bc1e8d6c22b4d911145a57c623303b296","current_bytes_required_to_match_historical":false,"hash_source":"git_blob_at_commit","path":"tests/test_train_closure_anfis_ablation.py","role":"superseded_mt_anfis_ablation_trainer_tests","sha256":"09ba3026fd08e753a6ec74990b584f6c88d20f48b659c6770ff2f857eac58196"}],"historical_components_sha256":"8d514e4152ed6533a0235149ae414793879f18d38307234443aff40fa5712857","p_component_count":2,"p_components":[{"bytes":29990,"path":"reports/closure_v1/00_protocol/anfis_ablation_training_development_patch_lock.json","role":"published_anfis_ablation_training_development_patch_lock","sha256":"b32b045d67e39c5afce67740f4efe49d575514013ba9fd3f986f7d47c67ef008"},{"bytes":11718,"path":"reports/closure_v1/00_protocol/anfis_ablation_training_development_patch_lock_manifest.json","role":"published_anfis_ablation_training_development_patch_lock_manifest","sha256":"466688edcf51dec11cdb30ac76c6e8e66013c77f73ae7ace44927b036ff80896"}],"p_components_git_mode":"100644","p_components_sha256":"436e0a1f2b25c0eb5db53acfa37b3f0a2cf8a8f840fa010db28c96e813deea3a","p_head":"1b68c24da4efe8fcf5eeb4b90ad0a99e95c96d93","p_parent":"f371786bc1e8d6c22b4d911145a57c623303b296","p_scope":{"added":2,"deleted":0,"modified":0},"preserved_component_count":6,"preserved_components":[{"bytes":9980,"path":"configs/closure_v1/anfis_ablation_training_development_patch_lock.schema.json","role":"preserved_mt_anfis_ablation_training_patch_lock_schema","sha256":"22fc373939252bc319f2cce3662563f32e30e3a87f22fa22189b1c6a5e8e5b95"},{"bytes":22694,"path":"configs/closure_v1/anfis_ablation_training_development_runtime.yaml","role":"preserved_mt_anfis_ablation_training_runtime","sha256":"cf2cec52d9027db895e8859c7ffb321c831b66510132e137759e567b363f6a50"},{"bytes":7184,"path":"docs/closure_v1/E0_M_ANFIS_ABLATION_TRAINING_DEVELOPMENT_PATCH_1.md","role":"preserved_mt_anfis_ablation_training_protocol","sha256":"079c8be0863b00ccfdd6bcd2df5b82026dec6edf7397e1f47527f65483932e65"},{"bytes":90730,"path":"src/experiments/closure_anfis_ablation_training_development_patch.py","role":"preserved_mt_anfis_ablation_training_validator","sha256":"392bf6f70ee073a7d1457296ee41700696340a6377cdcb14a92bcb0bcf65cb45"},{"bytes":8541,"path":"src/experiments/lock_closure_anfis_ablation_training_development_patch.py","role":"preserved_mt_anfis_ablation_training_locker","sha256":"9a52dd7f34d238dbb077340b4f6051630321127d74a1178625aa5678db45f8a6"},{"bytes":23803,"path":"tests/test_closure_anfis_ablation_training_development_patch.py","role":"preserved_mt_anfis_ablation_training_validator_tests","sha256":"37ceef3bc0fb1c63da025f1c3d31f7ce00502f9f511e3a4820d0f754dbd2e3b8"}],"preserved_components_sha256":"d1c400b786573e7911547d611bbc213aafe673251e9314ca5a7afc74c34eefa0"},"prelock":{"completed_prefix_count":0,"control_paths":{"mu_companion_absent":true,"mu_companion_temp_absent":true,"mu_lock_absent":true,"mu_lock_temp_absent":true,"mu_locker_guard_absent":true,"p_mt_companion_present":true,"p_mt_companion_temp_absent":true,"p_mt_lock_present":true,"p_mt_lock_temp_absent":true,"p_mt_locker_guard_absent":true},"final_paths_present":[],"guard_paths_present":[],"output_namespace_sha256":"f9935926a8d19236b4cc44ba1e17f1340269c29d249b30daa4c63bb39cb085fd","prediction_pointer_temporaries_present":[],"prediction_pointers_present":[],"prohibited_namespaces":{"e0_m_paths_absent":true,"outcome_access_log_absent":true},"temporary_paths_present":[]},"repository":{"branch":"main","head":"3fff3f272eb6f6ba8e644dd49436bc39ecbed1f8","parent":"1b68c24da4efe8fcf5eeb4b90ad0a99e95c96d93","remote_head":"3fff3f272eb6f6ba8e644dd49436bc39ecbed1f8","remote_verification_mode":"live_remote_main_verified","tracking_head":"3fff3f272eb6f6ba8e644dd49436bc39ecbed1f8","worktree_scope":"exact_h_patch_components_only"},"runtime_contract":{"model":{"architecture_reference":"src/experiments/train_pipe_grud.py","common_architecture":{"add_last":false,"bloom_head":"three_residual_logits_over_training_prevalence","dropout":0.0,"hidden_dimension":96,"recurrent_layers":1,"residual_mode":"training_only_horizon_priors","risk_head":"three_residual_logits_over_training_mean_risk","risk_logvar_clamp":[-10.0,2.0],"risk_uncertainty_head":"three_log_variances"},"execution":{"dataloader_num_workers":0,"deterministic_algorithms":true,"device":"cpu","drop_last":false,"epoch_seed